{"$schema":"https://json-schema.org/draft/2020-12/schema","$id":"https://github.com/newcovid/nonebot-plugin-yijing/data/schemas/lines.schema.json","title":"lines","description":"Structural six-line slots.","type":"array","items":{"type":"object","additionalProperties":true,"required":["hexagram_seq","position","yin_yang","label","line_label"],"properties":{"hexagram_seq":{"type":"integer","minimum":1,"maximum":64},"position":{"type":"integer","minimum":1,"maximum":6},"yin_yang":{"type":"string","enum":["yin","yang"]},"label":{"type":"string"},"line_label":{"type":"string"}}}}
