[
  {
    "hexagram_seq": 1,
    "position": 1,
    "yin_yang": "yang",
    "label": "初九",
    "line_label": "初九"
  },
  {
    "hexagram_seq": 1,
    "position": 2,
    "yin_yang": "yang",
    "label": "九二",
    "line_label": "九二"
  },
  {
    "hexagram_seq": 1,
    "position": 3,
    "yin_yang": "yang",
    "label": "九三",
    "line_label": "九三"
  },
  {
    "hexagram_seq": 1,
    "position": 4,
    "yin_yang": "yang",
    "label": "九四",
    "line_label": "九四"
  },
  {
    "hexagram_seq": 1,
    "position": 5,
    "yin_yang": "yang",
    "label": "九五",
    "line_label": "九五"
  },
  {
    "hexagram_seq": 1,
    "position": 6,
    "yin_yang": "yang",
    "label": "上九",
    "line_label": "上九"
  },
  {
    "hexagram_seq": 2,
    "position": 1,
    "yin_yang": "yin",
    "label": "初六",
    "line_label": "初六"
  },
  {
    "hexagram_seq": 2,
    "position": 2,
    "yin_yang": "yin",
    "label": "六二",
    "line_label": "六二"
  },
  {
    "hexagram_seq": 2,
    "position": 3,
    "yin_yang": "yin",
    "label": "六三",
    "line_label": "六三"
  },
  {
    "hexagram_seq": 2,
    "position": 4,
    "yin_yang": "yin",
    "label": "六四",
    "line_label": "六四"
  },
  {
    "hexagram_seq": 2,
    "position": 5,
    "yin_yang": "yin",
    "label": "六五",
    "line_label": "六五"
  },
  {
    "hexagram_seq": 2,
    "position": 6,
    "yin_yang": "yin",
    "label": "上六",
    "line_label": "上六"
  },
  {
    "hexagram_seq": 3,
    "position": 1,
    "yin_yang": "yang",
    "label": "初九",
    "line_label": "初九"
  },
  {
    "hexagram_seq": 3,
    "position": 2,
    "yin_yang": "yin",
    "label": "六二",
    "line_label": "六二"
  },
  {
    "hexagram_seq": 3,
    "position": 3,
    "yin_yang": "yin",
    "label": "六三",
    "line_label": "六三"
  },
  {
    "hexagram_seq": 3,
    "position": 4,
    "yin_yang": "yin",
    "label": "六四",
    "line_label": "六四"
  },
  {
    "hexagram_seq": 3,
    "position": 5,
    "yin_yang": "yang",
    "label": "九五",
    "line_label": "九五"
  },
  {
    "hexagram_seq": 3,
    "position": 6,
    "yin_yang": "yin",
    "label": "上六",
    "line_label": "上六"
  },
  {
    "hexagram_seq": 4,
    "position": 1,
    "yin_yang": "yin",
    "label": "初六",
    "line_label": "初六"
  },
  {
    "hexagram_seq": 4,
    "position": 2,
    "yin_yang": "yang",
    "label": "九二",
    "line_label": "九二"
  },
  {
    "hexagram_seq": 4,
    "position": 3,
    "yin_yang": "yin",
    "label": "六三",
    "line_label": "六三"
  },
  {
    "hexagram_seq": 4,
    "position": 4,
    "yin_yang": "yin",
    "label": "六四",
    "line_label": "六四"
  },
  {
    "hexagram_seq": 4,
    "position": 5,
    "yin_yang": "yin",
    "label": "六五",
    "line_label": "六五"
  },
  {
    "hexagram_seq": 4,
    "position": 6,
    "yin_yang": "yang",
    "label": "上九",
    "line_label": "上九"
  },
  {
    "hexagram_seq": 5,
    "position": 1,
    "yin_yang": "yang",
    "label": "初九",
    "line_label": "初九"
  },
  {
    "hexagram_seq": 5,
    "position": 2,
    "yin_yang": "yang",
    "label": "九二",
    "line_label": "九二"
  },
  {
    "hexagram_seq": 5,
    "position": 3,
    "yin_yang": "yang",
    "label": "九三",
    "line_label": "九三"
  },
  {
    "hexagram_seq": 5,
    "position": 4,
    "yin_yang": "yin",
    "label": "六四",
    "line_label": "六四"
  },
  {
    "hexagram_seq": 5,
    "position": 5,
    "yin_yang": "yang",
    "label": "九五",
    "line_label": "九五"
  },
  {
    "hexagram_seq": 5,
    "position": 6,
    "yin_yang": "yin",
    "label": "上六",
    "line_label": "上六"
  },
  {
    "hexagram_seq": 6,
    "position": 1,
    "yin_yang": "yin",
    "label": "初六",
    "line_label": "初六"
  },
  {
    "hexagram_seq": 6,
    "position": 2,
    "yin_yang": "yang",
    "label": "九二",
    "line_label": "九二"
  },
  {
    "hexagram_seq": 6,
    "position": 3,
    "yin_yang": "yin",
    "label": "六三",
    "line_label": "六三"
  },
  {
    "hexagram_seq": 6,
    "position": 4,
    "yin_yang": "yang",
    "label": "九四",
    "line_label": "九四"
  },
  {
    "hexagram_seq": 6,
    "position": 5,
    "yin_yang": "yang",
    "label": "九五",
    "line_label": "九五"
  },
  {
    "hexagram_seq": 6,
    "position": 6,
    "yin_yang": "yang",
    "label": "上九",
    "line_label": "上九"
  },
  {
    "hexagram_seq": 7,
    "position": 1,
    "yin_yang": "yin",
    "label": "初六",
    "line_label": "初六"
  },
  {
    "hexagram_seq": 7,
    "position": 2,
    "yin_yang": "yang",
    "label": "九二",
    "line_label": "九二"
  },
  {
    "hexagram_seq": 7,
    "position": 3,
    "yin_yang": "yin",
    "label": "六三",
    "line_label": "六三"
  },
  {
    "hexagram_seq": 7,
    "position": 4,
    "yin_yang": "yin",
    "label": "六四",
    "line_label": "六四"
  },
  {
    "hexagram_seq": 7,
    "position": 5,
    "yin_yang": "yin",
    "label": "六五",
    "line_label": "六五"
  },
  {
    "hexagram_seq": 7,
    "position": 6,
    "yin_yang": "yin",
    "label": "上六",
    "line_label": "上六"
  },
  {
    "hexagram_seq": 8,
    "position": 1,
    "yin_yang": "yin",
    "label": "初六",
    "line_label": "初六"
  },
  {
    "hexagram_seq": 8,
    "position": 2,
    "yin_yang": "yin",
    "label": "六二",
    "line_label": "六二"
  },
  {
    "hexagram_seq": 8,
    "position": 3,
    "yin_yang": "yin",
    "label": "六三",
    "line_label": "六三"
  },
  {
    "hexagram_seq": 8,
    "position": 4,
    "yin_yang": "yin",
    "label": "六四",
    "line_label": "六四"
  },
  {
    "hexagram_seq": 8,
    "position": 5,
    "yin_yang": "yang",
    "label": "九五",
    "line_label": "九五"
  },
  {
    "hexagram_seq": 8,
    "position": 6,
    "yin_yang": "yin",
    "label": "上六",
    "line_label": "上六"
  },
  {
    "hexagram_seq": 9,
    "position": 1,
    "yin_yang": "yang",
    "label": "初九",
    "line_label": "初九"
  },
  {
    "hexagram_seq": 9,
    "position": 2,
    "yin_yang": "yang",
    "label": "九二",
    "line_label": "九二"
  },
  {
    "hexagram_seq": 9,
    "position": 3,
    "yin_yang": "yang",
    "label": "九三",
    "line_label": "九三"
  },
  {
    "hexagram_seq": 9,
    "position": 4,
    "yin_yang": "yin",
    "label": "六四",
    "line_label": "六四"
  },
  {
    "hexagram_seq": 9,
    "position": 5,
    "yin_yang": "yang",
    "label": "九五",
    "line_label": "九五"
  },
  {
    "hexagram_seq": 9,
    "position": 6,
    "yin_yang": "yang",
    "label": "上九",
    "line_label": "上九"
  },
  {
    "hexagram_seq": 10,
    "position": 1,
    "yin_yang": "yang",
    "label": "初九",
    "line_label": "初九"
  },
  {
    "hexagram_seq": 10,
    "position": 2,
    "yin_yang": "yang",
    "label": "九二",
    "line_label": "九二"
  },
  {
    "hexagram_seq": 10,
    "position": 3,
    "yin_yang": "yin",
    "label": "六三",
    "line_label": "六三"
  },
  {
    "hexagram_seq": 10,
    "position": 4,
    "yin_yang": "yang",
    "label": "九四",
    "line_label": "九四"
  },
  {
    "hexagram_seq": 10,
    "position": 5,
    "yin_yang": "yang",
    "label": "九五",
    "line_label": "九五"
  },
  {
    "hexagram_seq": 10,
    "position": 6,
    "yin_yang": "yang",
    "label": "上九",
    "line_label": "上九"
  },
  {
    "hexagram_seq": 11,
    "position": 1,
    "yin_yang": "yang",
    "label": "初九",
    "line_label": "初九"
  },
  {
    "hexagram_seq": 11,
    "position": 2,
    "yin_yang": "yang",
    "label": "九二",
    "line_label": "九二"
  },
  {
    "hexagram_seq": 11,
    "position": 3,
    "yin_yang": "yang",
    "label": "九三",
    "line_label": "九三"
  },
  {
    "hexagram_seq": 11,
    "position": 4,
    "yin_yang": "yin",
    "label": "六四",
    "line_label": "六四"
  },
  {
    "hexagram_seq": 11,
    "position": 5,
    "yin_yang": "yin",
    "label": "六五",
    "line_label": "六五"
  },
  {
    "hexagram_seq": 11,
    "position": 6,
    "yin_yang": "yin",
    "label": "上六",
    "line_label": "上六"
  },
  {
    "hexagram_seq": 12,
    "position": 1,
    "yin_yang": "yin",
    "label": "初六",
    "line_label": "初六"
  },
  {
    "hexagram_seq": 12,
    "position": 2,
    "yin_yang": "yin",
    "label": "六二",
    "line_label": "六二"
  },
  {
    "hexagram_seq": 12,
    "position": 3,
    "yin_yang": "yin",
    "label": "六三",
    "line_label": "六三"
  },
  {
    "hexagram_seq": 12,
    "position": 4,
    "yin_yang": "yang",
    "label": "九四",
    "line_label": "九四"
  },
  {
    "hexagram_seq": 12,
    "position": 5,
    "yin_yang": "yang",
    "label": "九五",
    "line_label": "九五"
  },
  {
    "hexagram_seq": 12,
    "position": 6,
    "yin_yang": "yang",
    "label": "上九",
    "line_label": "上九"
  },
  {
    "hexagram_seq": 13,
    "position": 1,
    "yin_yang": "yang",
    "label": "初九",
    "line_label": "初九"
  },
  {
    "hexagram_seq": 13,
    "position": 2,
    "yin_yang": "yin",
    "label": "六二",
    "line_label": "六二"
  },
  {
    "hexagram_seq": 13,
    "position": 3,
    "yin_yang": "yang",
    "label": "九三",
    "line_label": "九三"
  },
  {
    "hexagram_seq": 13,
    "position": 4,
    "yin_yang": "yang",
    "label": "九四",
    "line_label": "九四"
  },
  {
    "hexagram_seq": 13,
    "position": 5,
    "yin_yang": "yang",
    "label": "九五",
    "line_label": "九五"
  },
  {
    "hexagram_seq": 13,
    "position": 6,
    "yin_yang": "yang",
    "label": "上九",
    "line_label": "上九"
  },
  {
    "hexagram_seq": 14,
    "position": 1,
    "yin_yang": "yang",
    "label": "初九",
    "line_label": "初九"
  },
  {
    "hexagram_seq": 14,
    "position": 2,
    "yin_yang": "yang",
    "label": "九二",
    "line_label": "九二"
  },
  {
    "hexagram_seq": 14,
    "position": 3,
    "yin_yang": "yang",
    "label": "九三",
    "line_label": "九三"
  },
  {
    "hexagram_seq": 14,
    "position": 4,
    "yin_yang": "yang",
    "label": "九四",
    "line_label": "九四"
  },
  {
    "hexagram_seq": 14,
    "position": 5,
    "yin_yang": "yin",
    "label": "六五",
    "line_label": "六五"
  },
  {
    "hexagram_seq": 14,
    "position": 6,
    "yin_yang": "yang",
    "label": "上九",
    "line_label": "上九"
  },
  {
    "hexagram_seq": 15,
    "position": 1,
    "yin_yang": "yin",
    "label": "初六",
    "line_label": "初六"
  },
  {
    "hexagram_seq": 15,
    "position": 2,